{
  "schema_version": 1,
  "name": "red-team",
  "version": "0.1.0",
  "kind": "domain-rich",
  "entrypoint": "SKILL.md",
  "portable_core_paths": [
    "references/portable-falsification-kernel.md"
  ],
  "domain_paths": [
    "SKILL.md",
    "README.md",
    "domain/catalogue.json",
    "domain/run-ledger.json",
    "domain/observation-topology.json",
    "domain/generation-close-runbook.md",
    "domain/residual-sensor-register.json",
    "receipts.json"
  ],
  "execution_paths": [
    "scripts/shadow_driver.py",
    "scripts/validate_red_team.py",
    "scripts/gen_receipts.py"
  ],
  "test_paths": [
    "tests/test_red_team.py"
  ],
  "eval_inventory": "evals/cases.json",
  "read_route": [
    "AGENTS.md",
    "README.md",
    "SKILL.md",
    "skill.json",
    "domain/catalogue.json"
  ],
  "forbidden_domain_literals": [
    "noodles",
    "skill-concerns",
    "HOST_OBSERVED",
    "userContentEdits",
    "catalogue.json"
  ],
  "shared_contracts": [
    "../../contracts/skill-manifest.schema.json",
    "../../contracts/source-lock.schema.json",
    "../../contracts/admission.schema.json",
    "../../scripts/common.py"
  ]
}
