{
  "schema_version": 1,
  "name": "spatial-loop-grounded",
  "version": "0.2.0",
  "kind": "domain-rich",
  "entrypoint": "SKILL.md",
  "portable_core_paths": [
    "references/portable-supervision-kernel.md"
  ],
  "domain_paths": [
    "SKILL.md",
    "README.md",
    "receipts.json",
    "domain/machine-topology.json"
  ],
  "execution_paths": [
    "scripts/ab_campaign.py",
    "scripts/validate_spatial_loop_grounded.py"
  ],
  "test_paths": [
    "tests/test_spatial_loop_grounded.py"
  ],
  "eval_inventory": "evals/cases.json",
  "read_route": [
    "AGENTS.md",
    "README.md",
    "SKILL.md",
    "skill.json",
    "receipts.json",
    "domain/machine-topology.json"
  ],
  "forbidden_domain_literals": [
    "gpt-5.6",
    "localhost:3210",
    "/Users/neon/",
    "ed3c-noodles-protection-audit",
    "noodles",
    "ed3c/",
    "launchctl"
  ],
  "shared_contracts": [
    "../../contracts/skill-manifest.schema.json",
    "../../contracts/source-lock.schema.json",
    "../../contracts/admission.schema.json",
    "../../scripts/common.py"
  ]
}
