{
  "schema_version": 1,
  "name": "shadow-architect",
  "version": "0.1.0",
  "kind": "domain-rich",
  "entrypoint": "SKILL.md",
  "portable_core_paths": [
    "references/portable-architecture-policy.md"
  ],
  "domain_paths": [
    "SKILL.md",
    "README.md",
    "domain/precedents.json",
    "receipts.json"
  ],
  "execution_paths": [
    "scripts/precedent_driver.py",
    "scripts/validate_shadow_architect.py",
    "scripts/gen_shadow_receipts.py"
  ],
  "test_paths": [
    "tests/test_shadow_architect.py"
  ],
  "eval_inventory": "evals/cases.json",
  "read_route": [
    "AGENTS.md",
    "README.md",
    "SKILL.md",
    "skill.json",
    "domain/precedents.json"
  ],
  "forbidden_domain_literals": [
    "noodles",
    "skill-concerns",
    "ed3c",
    "/Users/",
    "precedents.json",
    "precedent_driver.py",
    "wave-17"
  ],
  "shared_contracts": [
    "../../contracts/skill-manifest.schema.json",
    "../../contracts/source-lock.schema.json",
    "../../contracts/admission.schema.json",
    "../../scripts/common.py"
  ]
}
